scenario_id;description;light_position;observer_position;surface_normal;material_type;expected_behavior;raw_L_R;raw_L_G;raw_L_B;passed
mirror_valid_reflection;Зеркальная поверхность, наблюдатель расположен вдоль отраженного луча.;(1.000000, 0.000000, 1.000000);(-2.000000, 0.000000, 2.000000);(0.000000, 0.000000, 1.000000);зеркальный;Ожидается ненулевая яркость.;1.000000;1.000000;1.000000;да
observer_below_mirror;Наблюдатель находится под зеркальной поверхностью.;(1.000000, 0.000000, 1.000000);(-2.000000, 0.000000, -2.000000);(0.000000, 0.000000, 1.000000);зеркальный;Яркость должна быть нулевой для наблюдателя с обратной стороны.;0.000000;0.000000;0.000000;да
light_below_surface;Источник света находится под односторонней поверхностью.;(0.000000, 0.000000, -2.000000);(0.000000, 0.000000, 3.000000);(0.000000, 0.000000, 1.000000);зеркальный;Яркость должна быть нулевой, потому что свет приходит с обратной стороны.;0.000000;0.000000;0.000000;да
diffuse_front_lit;Диффузная поверхность освещена с лицевой стороны.;(0.000000, 0.000000, 2.000000);(0.000000, 0.000000, 3.000000);(0.000000, 0.000000, 1.000000);диффузный;Ожидается ненулевая диффузная яркость.;0.700000;0.600000;0.500000;да
diffuse_back_lit;Диффузная поверхность освещена с обратной стороны.;(0.000000, 0.000000, -2.000000);(0.000000, 0.000000, 3.000000);(0.000000, 0.000000, 1.000000);диффузный;Яркость должна быть нулевой, потому что поверхность освещена с обратной стороны.;0.000000;0.000000;0.000000;да
observer_back_side;Наблюдатель находится с обратной стороны освещенной односторонней поверхности.;(0.000000, 0.000000, 2.000000);(0.000000, 0.000000, -3.000000);(0.000000, 0.000000, 1.000000);диффузный;Яркость должна быть нулевой для наблюдателя с обратной стороны.;0.000000;0.000000;0.000000;да
